{
  "$id": "EFAB6k77bXHs6bg9PORW7UYF79GD_OuEcEjmBpwhcfRN",
  "$schema": "https://json-schema.org/draft/2020-12/schema",
  "title": "SEDI IAR Schema",
  "description": "SEDI IAR Identity Assurance Receipt JSON Schema for acm ACDC.",
  "credentialType": "SEDI_IAR_ACDC_acm_message",
  "version": "0.1.0",
  "type": "object",
  "required": [
    "v",
    "d",
    "i",
    "s",
    "a"
  ],
  "properties": {
    "v": {
      "description": "ACDC version string",
      "type": "string"
    },
    "t": {
      "description": "Message type",
      "type": "string"
    },
    "d": {
      "description": "Message SAID",
      "type": "string"
    },
    "u": {
      "description": "Message UE",
      "type": "string"
    },
    "i": {
      "description": "Issuer AID",
      "type": "string"
    },
    "s": {
      "description": "Schema Section",
      "oneOf": [
        {
          "description": "Schema Section SAID",
          "type": "string"
        },
        {
          "description": "Schema Section Detail",
          "type": "object"
        }
      ]
    },
    "a": {
      "description": "Attribute Section",
      "oneOf": [
        {
          "description": "Attribute Section SAID",
          "type": "string"
        },
        {
          "description": "Attribute Section Detail",
          "type": "object",
          "required": [
            "d",
            "i",
            "givenName",
            "middleName",
            "familyName",
            "nameSuffix",
            "birthDate",
            "facialImageProof",
            "legalPresenceStatus",
            "residence",
            "proofingDatetime",
            "sediURL"
          ],
          "properties": {
            "d": {
              "description": "Attribute Section SAID",
              "type": "string"
            },
            "i": {
              "description": "Issuee SMAID SEDI Management AID",
              "type": "string"
            },
            "givenName": {
              "description": "Given Name",
              "type": "string"
            },
            "middleName": {
              "description": "Middle Name(s)",
              "type": "string"
            },
            "familyName": {
              "description": "Family Name",
              "type": "string"
            },
            "nameSuffix": {
              "description": "Name Suffix",
              "type": "string"
            },
            "birthDate": {
              "description": "Date of birth RFC-3339/ISO-8601 time MBZ",
              "type": "string"
            },
            "facialImageProof": {
              "description": "Image typed media block SAID",
              "type": "string"
            },
            "legalPresenceStatus": {
              "description": "Legal presences status i.e. citizen",
              "type": "string"
            },
            "residence": {
              "description": "Residence detail",
              "type": "object",
              "required": [
                "street",
                "city",
                "county",
                "state",
                "postcode",
                "country"
              ],
              "properties": {
                "street": {
                  "description": "Street address with unit",
                  "type": "string"
                },
                "city": {
                  "description": "City name",
                  "type": "string"
                },
                "county": {
                  "description": "County name",
                  "type": "string"
                },
                "state": {
                  "description": "State name",
                  "type": "string"
                },
                "postcode": {
                  "description": "Postal (zip) code",
                  "type": "string"
                },
                "country": {
                  "description": "Country name",
                  "type": "string"
                }
              }
            },
            "proofingDatetime": {
              "description": "Proofing session datetime RFC-3339/ISO-8601",
              "type": "string"
            },
            "sediURL": {
              "description": "URL to obtain SEDI",
              "type": "string"
            }
          },
          "additionalProperties": false
        }
      ]
    },
    "r": {
      "description": "Rule Section",
      "oneOf": [
        {
          "description": "Rule Section SAID",
          "type": "string"
        },
        {
          "description": "Rule Section Detail",
          "type": "object",
          "required": [
            "d",
            "l"
          ],
          "properties": {
            "d": {
              "description": "Rule Section SAID",
              "type": "string"
            },
            "l": {
              "description": "Legal Language",
              "type": "string"
            }
          },
          "additionalProperties": false
        }
      ]
    }
  },
  "additionalProperties": false
}
