{
  "v": "ACDCCAACAAJSONAAMR.",
  "t": "acm",
  "d": "EByqzW5jFrrXhC_b9jYkHJaWAoc3L5GTqmmWUnq4KGQ9",
  "u": "0ABndXlzZWRpY2hhbGxlbmdl",
  "i": "EAgq2LY03zk9NUempbqdLzG4PiGnmVMqTD0DfrY9Whwh",
  "s": "EFAB6k77bXHs6bg9PORW7UYF79GD_OuEcEjmBpwhcfRN",
  "a": {
    "d": "EM6r7vSi3Egpp0KB5O6WjB2g-wfwLey1J_NI3K1vJ_PR",
    "i": "EDB8gKNwzurf33pV2hsyGR9XFOmitDhc0LUzDamcU2JR",
    "givenName": "Guy",
    "middleName": "Marty McFly",
    "familyName": "Brown",
    "nameSuffix": "Jr",
    "birthDate": "2002-08-22T00:00:00.000000+00:00",
    "facialImageProof": "EIQw_2CqmmC96YYUFXTW8XSkLQU2-v9bDCyItazmKhTW",
    "legalPresenceStatus": "citizen",
    "residence": {
      "street": "157 E 300 N",
      "city": "Beaver",
      "county": "Beaver",
      "state": "Utah",
      "postcode": "84713",
      "country": "United States"
    },
    "proofingDatetime": "2026-09-01T09:30:00.000000+00:00",
    "sediURL": "https://example.com/sedi/here"
  }
}
